<?xml version="1.0" encoding="UTF-8"?>
<?xml-stylesheet type="text/css" href="css/ejercicio-ii-1b-dtd.css" ?>
<!DOCTYPE fichero SYSTEM "dtd/ejercicioII.2b.dtd">
<fichero>
 <ficha>
  <nombre sexo="m" >Abraham</nombre>
  <apellido>
  <primerapellido>Bell</primerapellido>
  <segundoapellido>Bell</segundoapellido>
  </apellido>
  <fechanacimiento>12/07/2005</fechanacimiento>
  
  <direccion>
  <departamento>San Salvador</departamento>
  <municipio>Apopa</municipio>
  <calle>carretera troncal del Norte,km 12</calle>
  </direccion>
  <carnetminoridad>521456632</carnetminoridad>
 </ficha>
 
 
 <!-- ficha sexo femenino-->
 <ficha>
  <nombre sexo="f" >Adela</nombre>
  <apellido>
  <primerapellido>Ramirez</primerapellido>
  <segundoapellido tipo="casada" apellidodesoltera="Aguilar"> de Beltran </segundoapellido>
  </apellido>
  <fechanacimiento>12/07/1995</fechanacimiento>
  
  <direccion>
  <departamento>La Libertad</departamento>
  <municipio>Chiltiupán</municipio>
  <calle>carretera a la Costa del Sol,casa N.14</calle>
  </direccion>
  <DUI>52145452-2</DUI>
  <NIT>4634-12071995-125-2</NIT>
 </ficha>
</fichero>
